{
  "$schema": "http://json-schema.org/draft-07/schema#",
  "title": "eval-bridge fixture",
  "type": "object",
  "required": ["trace_id", "prompt"],
  "properties": {
    "trace_id": {
      "type": "string",
      "minLength": 1,
      "description": "Stable identifier for this fixture."
    },
    "prompt": {
      "type": "string",
      "description": "User prompt to send to the model."
    },
    "system": {
      "type": ["string", "null"],
      "description": "Optional system message."
    },
    "messages": {
      "type": "array",
      "description": "Optional full chat history (overrides prompt/system).",
      "items": {
        "type": "object",
        "required": ["role", "content"],
        "properties": {
          "role": {"type": "string", "enum": ["system", "user", "assistant"]},
          "content": {"type": "string"}
        },
        "additionalProperties": false
      }
    },
    "model": {
      "type": ["string", "null"],
      "description": "Model name passed to the provider."
    },
    "expected_substrings": {
      "type": "array",
      "items": {"type": "string"},
      "description": "Strings that must appear in the model's reply."
    },
    "forbidden_substrings": {
      "type": "array",
      "items": {"type": "string"},
      "description": "Strings that must NOT appear in the model's reply."
    },
    "schema": {
      "type": ["object", "null"],
      "description": "Optional JSON Schema the model's reply must conform to."
    },
    "semantic_threshold": {
      "type": ["number", "null"],
      "minimum": 0.0,
      "maximum": 1.0,
      "description": "Minimum Jaccard similarity vs. reference_reply (if provided)."
    },
    "reference_reply": {
      "type": ["string", "null"],
      "description": "Reference text used to compute semantic_threshold."
    },
    "capture": {
      "type": "object",
      "description": "Free-form metadata about the original capture."
    },
    "fixture_response": {
      "type": ["string", "null"],
      "description": "Optional canned response for offline (fixture) provider."
    },
    "context": {
      "type": ["string", "null"],
      "description": "Optional context (RAG) the reply is expected to be grounded in."
    },
    "judge_criteria": {
      "type": ["string", "null"],
      "description": "Optional free-text criteria for a G-Eval-style scorer."
    },
    "judge_scorers": {
      "type": "array",
      "items": {
        "type": "string",
        "enum": ["hallucination", "faithfulness", "answer_relevance", "toxicity", "bias", "g_eval"]
      },
      "description": "Scorers to apply via the LLM-as-judge layer (offline in CI, live in dev)."
    },
    "message_assertions": {
      "type": "array",
      "description": "Per-message assertions for multi-turn fixtures. Each entry has role (system|user|assistant|any), must_contain (list of strings), and must_not_contain (list of strings). Evaluated against every message with that role in the chat history.",
      "items": {
        "type": "object",
        "properties": {
          "role": {"type": "string", "enum": ["system", "user", "assistant", "any"]},
          "must_contain": {"type": "array", "items": {"type": "string"}},
          "must_not_contain": {"type": "array", "items": {"type": "string"}}
        },
        "additionalProperties": false
      }
    },
    "expected_tool_calls": {
      "type": "array",
      "description": "Expected sequence of tool calls the model should make. Each entry has a 'name' and an 'arguments' object. Compared deep-equal (argument-key order insensitive).",
      "items": {
        "type": "object",
        "required": ["name", "arguments"],
        "properties": {
          "name": {"type": "string", "minLength": 1},
          "arguments": {"type": "object"}
        },
        "additionalProperties": false
      }
    }
  },
  "additionalProperties": true
}
